{
  "$schema": "https://ferricov.dev/schema/behavior-contract-fragment.schema.json",
  "behavior_groups": [],
  "case_groups": [],
  "description": "Deterministic unreviewed public inventory skeleton bucket 4 for the command-xml2lcovutil-py responsibility domain.",
  "fragment_id": "generated.inventory.command-xml2lcovutil-py.4",
  "fragment_type": "generated",
  "interaction_groups": [],
  "schema_version": 1,
  "subjects": []
}
