{
  "$schema": "https://ferricov.dev/schema/behavior-contract-fragment.schema.json",
  "behavior_groups": [],
  "case_groups": [
    {
      "applicability": {
        "conditions": [],
        "status": "all_supported_environments"
      },
      "behavior_groups": [],
      "case_class": "acceptance",
      "comparison_dimensions": [
        "exit",
        "filesystem",
        "stderr",
        "stdout"
      ],
      "description": "Reviewed source-bound plan for command.genhtml.option.footer: cli-option boundary `--footer CLI Footer` uses shared `--config-file control.lcovrc` defaults and the direct option delta. The pinned Oracle suite records exit, stdout, stderr, and filesystem reference/output characterization with reference file-tree SHA-256 `a05c4105eff8f5dafd6af9c443ea4993b93d8465e7b10a418ea50c67ae5e3a3f`; this is planning-only and claims no Ferricov product evidence.",
      "evidence": [],
      "evidence_status": "planned",
      "id": "case.acceptance.command.genhtml.option.footer",
      "interaction_groups": [],
      "origin": "manually_curated",
      "review_status": "reviewed",
      "source_references": [
        {
          "kind": "command_implementation",
          "line": 7157,
          "path": "bin/genhtml",
          "repository": "lcov-v2.5",
          "text": "               \"genhtml_footer\"              => \\$footer,"
        },
        {
          "kind": "parser_definition",
          "line": 7222,
          "path": "bin/genhtml",
          "repository": "lcov-v2.5",
          "text": "                     \"footer=s\"             => \\$footer,"
        },
        {
          "kind": "command_implementation",
          "line": 11706,
          "path": "bin/genhtml",
          "repository": "lcov-v2.5",
          "text": "        defined($main::footer) ? $footer :"
        }
      ],
      "suite_cases": [
        {
          "case_id": "m0-genhtml-cli-report-contract-control",
          "suite_id": "m0-genhtml-cli-report-contract"
        },
        {
          "case_id": "m0-genhtml-cli-report-contract-footer",
          "suite_id": "m0-genhtml-cli-report-contract"
        }
      ],
      "surface": "cli",
      "targets": [
        {
          "id": "command.genhtml.option.footer",
          "role": "primary"
        }
      ],
      "upstream_tests": []
    },
    {
      "applicability": {
        "conditions": [],
        "status": "all_supported_environments"
      },
      "behavior_groups": [],
      "case_class": "acceptance",
      "comparison_dimensions": [
        "exit",
        "filesystem",
        "stderr",
        "stdout"
      ],
      "description": "Reviewed source-bound plan for command.genhtml.option.no-checksum: cli-option boundary `--no-checksum` uses shared `--config-file control.lcovrc` defaults and the direct option delta. The pinned Oracle suite records exit, stdout, stderr, and filesystem reference/output characterization with reference file-tree SHA-256 `0b2d3c12d04b463b1c356b0369186a2c3f791556b64c9de7191a16856654bd5c`; this is planning-only and claims no Ferricov product evidence.",
      "evidence": [],
      "evidence_status": "planned",
      "id": "case.acceptance.command.genhtml.option.no-checksum",
      "interaction_groups": [],
      "origin": "manually_curated",
      "review_status": "reviewed",
      "source_references": [
        {
          "kind": "parser_definition",
          "line": 1243,
          "path": "lib/lcovutil.pm",
          "repository": "lcov-v2.5",
          "text": "                  \"no-checksum\" => \\$rc_no_checksum,"
        },
        {
          "kind": "command_implementation",
          "line": 1596,
          "path": "lib/lcovutil.pm",
          "repository": "lcov-v2.5",
          "text": "    $lcovutil::verify_checksum = 0"
        },
        {
          "kind": "command_implementation",
          "line": 9779,
          "path": "lib/lcovutil.pm",
          "repository": "lcov-v2.5",
          "text": "                                       $lcovutil::verify_checksum, 1);"
        }
      ],
      "suite_cases": [
        {
          "case_id": "m0-genhtml-cli-report-contract-control",
          "suite_id": "m0-genhtml-cli-report-contract"
        },
        {
          "case_id": "m0-genhtml-cli-report-contract-no-checksum",
          "suite_id": "m0-genhtml-cli-report-contract"
        }
      ],
      "surface": "cli",
      "targets": [
        {
          "id": "command.genhtml.option.no-checksum",
          "role": "primary"
        }
      ],
      "upstream_tests": []
    },
    {
      "applicability": {
        "conditions": [],
        "status": "all_supported_environments"
      },
      "behavior_groups": [],
      "case_class": "acceptance",
      "comparison_dimensions": [
        "exit",
        "filesystem",
        "stderr",
        "stdout"
      ],
      "description": "Reviewed source-bound plan for command.genhtml.option.no-html: cli-option boundary `--no-html` uses shared `--config-file control.lcovrc` defaults and the direct option delta. The pinned Oracle suite records exit, stdout, stderr, and filesystem reference/output characterization with reference file-tree SHA-256 `aa4c1afab3bf0f16591e032c947f8b558c139a4fe36ab2d877da293f03ed41e8`; this is planning-only and claims no Ferricov product evidence.",
      "evidence": [],
      "evidence_status": "planned",
      "id": "case.acceptance.command.genhtml.option.no-html",
      "interaction_groups": [],
      "origin": "manually_curated",
      "review_status": "reviewed",
      "source_references": [
        {
          "kind": "parser_definition",
          "line": 7251,
          "path": "bin/genhtml",
          "repository": "lcov-v2.5",
          "text": "                     'no-html'           => \\$no_html,"
        },
        {
          "kind": "command_implementation",
          "line": 7291,
          "path": "bin/genhtml",
          "repository": "lcov-v2.5",
          "text": "$no_sourceview             = 1 if $no_html;"
        },
        {
          "kind": "command_implementation",
          "line": 7951,
          "path": "bin/genhtml",
          "repository": "lcov-v2.5",
          "text": "    unless ($no_html) {"
        }
      ],
      "suite_cases": [
        {
          "case_id": "m0-genhtml-cli-report-contract-control",
          "suite_id": "m0-genhtml-cli-report-contract"
        },
        {
          "case_id": "m0-genhtml-cli-report-contract-no-html",
          "suite_id": "m0-genhtml-cli-report-contract"
        }
      ],
      "surface": "cli",
      "targets": [
        {
          "id": "command.genhtml.option.no-html",
          "role": "primary"
        }
      ],
      "upstream_tests": []
    }
  ],
  "description": "Reviewed suite-bound genhtml CLI report plans for three direct options; no product evidence.",
  "fragment_id": "authored.m0-genhtml-cli-report-wave",
  "fragment_type": "authored",
  "interaction_groups": [],
  "schema_version": 1,
  "subjects": []
}
