{
  "$schema": "https://ferricov.dev/schema/behavior-contract-fragment.schema.json",
  "behavior_groups": [],
  "case_groups": [],
  "description": "Deterministic unreviewed public inventory skeleton bucket 1 for the command-py2lcov responsibility domain.",
  "fragment_id": "generated.inventory.command-py2lcov.1",
  "fragment_type": "generated",
  "interaction_groups": [],
  "schema_version": 1,
  "subjects": []
}
