{
  "$schema": "https://ferricov.dev/schema/behavior-contract-fragment.schema.json",
  "behavior_groups": [],
  "case_groups": [],
  "description": "Deterministic unreviewed public inventory skeleton bucket 0 for the support-scripts responsibility domain.",
  "fragment_id": "generated.inventory.support-scripts.0",
  "fragment_type": "generated",
  "interaction_groups": [],
  "schema_version": 1,
  "subjects": []
}
