{
  "$schema": "https://ferricov.dev/schema/behavior-contract-fragment.schema.json",
  "behavior_groups": [],
  "case_groups": [
    {
      "applicability": {
        "conditions": [],
        "status": "all_supported_environments"
      },
      "behavior_groups": [],
      "case_class": "acceptance",
      "comparison_dimensions": [
        "exit",
        "filesystem",
        "stderr",
        "stdout"
      ],
      "description": "Unreviewed acceptance skeleton for command.genpng.option.width; observable semantics, fixtures, and expected outcomes require manual adjudication.",
      "evidence": [],
      "evidence_status": "none",
      "id": "case.acceptance.command.genpng.option.width",
      "interaction_groups": [],
      "origin": "generated_skeleton",
      "review_status": "unreviewed",
      "source_references": [
        {
          "kind": "parser_definition",
          "line": 83,
          "path": "bin/genpng",
          "repository": "lcov-v2.5"
        },
        {
          "kind": "manual_candidate",
          "line": 23,
          "path": "docs/man/genpng.rst",
          "repository": "lcov-v2.5"
        },
        {
          "kind": "manual_candidate",
          "line": 55,
          "path": "docs/man/genpng.rst",
          "repository": "lcov-v2.5"
        },
        {
          "kind": "help_definition",
          "line": 10,
          "path": "help/genpng.txt",
          "repository": "lcov-v2.5"
        }
      ],
      "suite_cases": [],
      "surface": "cli",
      "targets": [
        {
          "id": "command.genpng.option.width",
          "role": "primary"
        }
      ],
      "upstream_tests": []
    }
  ],
  "description": "Deterministic unreviewed public inventory skeleton bucket 5 for the command-genpng responsibility domain.",
  "fragment_id": "generated.inventory.command-genpng.5",
  "fragment_type": "generated",
  "interaction_groups": [],
  "schema_version": 1,
  "subjects": []
}
