{
  "$schema": "https://ferricov.dev/schema/behavior-contract-fragment.schema.json",
  "behavior_groups": [],
  "case_groups": [
    {
      "applicability": {
        "conditions": [],
        "status": "all_supported_environments"
      },
      "behavior_groups": [],
      "case_class": "acceptance",
      "comparison_dimensions": [
        "exit",
        "filesystem",
        "stderr",
        "stdout"
      ],
      "description": "Unreviewed acceptance skeleton for command.gendesc.option.output-filename; observable semantics, fixtures, and expected outcomes require manual adjudication.",
      "evidence": [],
      "evidence_status": "none",
      "id": "case.acceptance.command.gendesc.option.output-filename",
      "interaction_groups": [],
      "origin": "generated_skeleton",
      "review_status": "unreviewed",
      "source_references": [
        {
          "kind": "parser_definition",
          "line": 70,
          "path": "bin/gendesc",
          "repository": "lcov-v2.5"
        },
        {
          "kind": "manual_candidate",
          "line": 19,
          "path": "docs/man/gendesc.rst",
          "repository": "lcov-v2.5"
        },
        {
          "kind": "manual_candidate",
          "line": 57,
          "path": "docs/man/gendesc.rst",
          "repository": "lcov-v2.5"
        },
        {
          "kind": "help_definition",
          "line": 8,
          "path": "help/gendesc.txt",
          "repository": "lcov-v2.5"
        }
      ],
      "suite_cases": [],
      "surface": "cli",
      "targets": [
        {
          "id": "command.gendesc.option.output-filename",
          "role": "primary"
        }
      ],
      "upstream_tests": []
    },
    {
      "applicability": {
        "conditions": [],
        "status": "all_supported_environments"
      },
      "behavior_groups": [],
      "case_class": "acceptance",
      "comparison_dimensions": [
        "exit",
        "filesystem",
        "stderr",
        "stdout"
      ],
      "description": "Unreviewed acceptance skeleton for command.gendesc.positional.inputfile; observable semantics, fixtures, and expected outcomes require manual adjudication.",
      "evidence": [],
      "evidence_status": "none",
      "id": "case.acceptance.command.gendesc.positional.inputfile",
      "interaction_groups": [],
      "origin": "generated_skeleton",
      "review_status": "unreviewed",
      "source_references": [
        {
          "kind": "parser_definition",
          "line": 78,
          "path": "bin/gendesc",
          "repository": "lcov-v2.5"
        }
      ],
      "suite_cases": [],
      "surface": "cli",
      "targets": [
        {
          "id": "command.gendesc.positional.inputfile",
          "role": "primary"
        }
      ],
      "upstream_tests": []
    }
  ],
  "description": "Deterministic unreviewed public inventory skeleton bucket 1 for the command-gendesc responsibility domain.",
  "fragment_id": "generated.inventory.command-gendesc.1",
  "fragment_type": "generated",
  "interaction_groups": [],
  "schema_version": 1,
  "subjects": []
}
