{
  "$schema": "https://ferricov.dev/schema/behavior-contract-fragment.schema.json",
  "behavior_groups": [],
  "case_groups": [
    {
      "applicability": {
        "conditions": [],
        "status": "all_supported_environments"
      },
      "behavior_groups": [],
      "case_class": "acceptance",
      "comparison_dimensions": [
        "exit",
        "filesystem",
        "stderr",
        "stdout"
      ],
      "description": "Unbound source-bound plan for lcovrc.geninfo-interval-update: config-key boundary `geninfo_interval_update = <value>` from pinned inventory source references. Expected comparison dimensions are exit, stdout, stderr, and filesystem once an executable suite exists. No reviewed upstream public-behavior driver or compatibility suite currently binds this entry; this is not reviewed closure and claims no Ferricov product evidence.",
      "evidence": [],
      "evidence_status": "none",
      "id": "case.acceptance.lcovrc.geninfo-interval-update",
      "interaction_groups": [],
      "origin": "manually_curated",
      "review_status": "unreviewed",
      "source_references": [
        {
          "kind": "config_definition",
          "line": 1234,
          "path": "lib/lcovutil.pm",
          "repository": "lcov-v2.5"
        }
      ],
      "suite_cases": [],
      "surface": "config",
      "targets": [
        {
          "id": "lcovrc.geninfo-interval-update",
          "role": "primary"
        }
      ],
      "upstream_tests": []
    },
    {
      "applicability": {
        "conditions": [],
        "status": "all_supported_environments"
      },
      "behavior_groups": [],
      "case_class": "acceptance",
      "comparison_dimensions": [
        "exit",
        "filesystem",
        "stderr",
        "stdout"
      ],
      "description": "Unbound source-bound plan for lcovrc.lcov-filter-chunk-size: config-key boundary `lcov_filter_chunk_size = <value>` from pinned inventory source references. Expected comparison dimensions are exit, stdout, stderr, and filesystem once an executable suite exists. No reviewed upstream public-behavior driver or compatibility suite currently binds this entry; this is not reviewed closure and claims no Ferricov product evidence.",
      "evidence": [],
      "evidence_status": "none",
      "id": "case.acceptance.lcovrc.lcov-filter-chunk-size",
      "interaction_groups": [],
      "origin": "manually_curated",
      "review_status": "unreviewed",
      "source_references": [
        {
          "kind": "config_definition",
          "line": 1203,
          "path": "lib/lcovutil.pm",
          "repository": "lcov-v2.5"
        }
      ],
      "suite_cases": [],
      "surface": "config",
      "targets": [
        {
          "id": "lcovrc.lcov-filter-chunk-size",
          "role": "primary"
        }
      ],
      "upstream_tests": []
    },
    {
      "applicability": {
        "conditions": [],
        "status": "all_supported_environments"
      },
      "behavior_groups": [],
      "case_class": "acceptance",
      "comparison_dimensions": [
        "exit",
        "filesystem",
        "stderr",
        "stdout"
      ],
      "description": "Unbound source-bound plan for lcovrc.lcov-filter-parallel: config-key boundary `lcov_filter_parallel = <value>` from pinned inventory source references. Expected comparison dimensions are exit, stdout, stderr, and filesystem once an executable suite exists. No reviewed upstream public-behavior driver or compatibility suite currently binds this entry; this is not reviewed closure and claims no Ferricov product evidence.",
      "evidence": [],
      "evidence_status": "none",
      "id": "case.acceptance.lcovrc.lcov-filter-parallel",
      "interaction_groups": [],
      "origin": "manually_curated",
      "review_status": "unreviewed",
      "source_references": [
        {
          "kind": "config_definition",
          "line": 1202,
          "path": "lib/lcovutil.pm",
          "repository": "lcov-v2.5"
        }
      ],
      "suite_cases": [],
      "surface": "config",
      "targets": [
        {
          "id": "lcovrc.lcov-filter-parallel",
          "role": "primary"
        }
      ],
      "upstream_tests": []
    },
    {
      "applicability": {
        "conditions": [],
        "status": "all_supported_environments"
      },
      "behavior_groups": [],
      "case_class": "acceptance",
      "comparison_dimensions": [
        "exit",
        "filesystem",
        "stderr",
        "stdout"
      ],
      "description": "Unbound source-bound plan for lcovrc.max-fork-fails: config-key boundary `max_fork_fails = <int>` from `# max_fork_fails = 5`. Expected comparison dimensions are exit, stdout, stderr, and filesystem once an executable suite exists. No reviewed upstream public-behavior driver or compatibility suite currently binds this entry; this is not reviewed closure and claims no Ferricov product evidence.",
      "evidence": [],
      "evidence_status": "none",
      "id": "case.acceptance.lcovrc.max-fork-fails",
      "interaction_groups": [],
      "origin": "manually_curated",
      "review_status": "unreviewed",
      "source_references": [
        {
          "kind": "config_definition",
          "line": 456,
          "path": "lcovrc",
          "repository": "lcov-v2.5"
        },
        {
          "kind": "config_definition",
          "line": 1163,
          "path": "lib/lcovutil.pm",
          "repository": "lcov-v2.5"
        }
      ],
      "suite_cases": [],
      "surface": "config",
      "targets": [
        {
          "id": "lcovrc.max-fork-fails",
          "role": "primary"
        }
      ],
      "upstream_tests": []
    },
    {
      "applicability": {
        "conditions": [],
        "status": "all_supported_environments"
      },
      "behavior_groups": [],
      "case_class": "acceptance",
      "comparison_dimensions": [
        "exit",
        "filesystem",
        "stderr",
        "stdout"
      ],
      "description": "Unbound source-bound plan for lcovrc.max-tasks-per-core: config-key boundary `max_tasks_per_core = <int>` from `# max_tasks_per_core = 20`. Expected comparison dimensions are exit, stdout, stderr, and filesystem once an executable suite exists. No reviewed upstream public-behavior driver or compatibility suite currently binds this entry; this is not reviewed closure and claims no Ferricov product evidence.",
      "evidence": [],
      "evidence_status": "none",
      "id": "case.acceptance.lcovrc.max-tasks-per-core",
      "interaction_groups": [],
      "origin": "manually_curated",
      "review_status": "unreviewed",
      "source_references": [
        {
          "kind": "config_definition",
          "line": 460,
          "path": "lcovrc",
          "repository": "lcov-v2.5"
        },
        {
          "kind": "config_definition",
          "line": 1164,
          "path": "lib/lcovutil.pm",
          "repository": "lcov-v2.5"
        }
      ],
      "suite_cases": [],
      "surface": "config",
      "targets": [
        {
          "id": "lcovrc.max-tasks-per-core",
          "role": "primary"
        }
      ],
      "upstream_tests": []
    },
    {
      "applicability": {
        "conditions": [],
        "status": "all_supported_environments"
      },
      "behavior_groups": [],
      "case_class": "acceptance",
      "comparison_dimensions": [
        "exit",
        "filesystem",
        "stderr",
        "stdout"
      ],
      "description": "Unbound source-bound plan for lcovrc.parallel: config-key boundary `parallel = <0|1>` from `#parallel = 1`. Expected comparison dimensions are exit, stdout, stderr, and filesystem once an executable suite exists. No reviewed upstream public-behavior driver or compatibility suite currently binds this entry; this is not reviewed closure and claims no Ferricov product evidence.",
      "evidence": [],
      "evidence_status": "none",
      "id": "case.acceptance.lcovrc.parallel",
      "interaction_groups": [],
      "origin": "manually_curated",
      "review_status": "unreviewed",
      "source_references": [
        {
          "kind": "config_definition",
          "line": 447,
          "path": "lcovrc",
          "repository": "lcov-v2.5"
        },
        {
          "kind": "config_definition",
          "line": 1160,
          "path": "lib/lcovutil.pm",
          "repository": "lcov-v2.5"
        }
      ],
      "suite_cases": [],
      "surface": "config",
      "targets": [
        {
          "id": "lcovrc.parallel",
          "role": "primary"
        }
      ],
      "upstream_tests": []
    }
  ],
  "description": "Unreviewed timing, performance, and fault-injection lcovrc primary plans without stable differential observables; no product evidence.",
  "fragment_id": "authored.m0-lcovrc-blocked-wave",
  "fragment_type": "authored",
  "interaction_groups": [],
  "schema_version": 1,
  "subjects": []
}
